post_id,timestamp,email,post_type,post_audience,active_subscription,country,city,region,device_type,client_os,client_type,user_agent
52717070,2022-04-23T06:43:00.719Z,olshansky.daniel@gmail.com,newsletter,everyone,false,US,Seattle,WA,desktop,OS X,browser,"Mozilla/5.0 (Macintosh; Intel Mac OS X 10_15_7) AppleWebKit/537.36 (KHTML, like Gecko) Chrome/100.0.4896.127 Safari/537.36"
52717070,2022-04-23T06:43:03.581Z,olshansky.daniel@gmail.com,newsletter,everyone,false,US,Seattle,WA,desktop,Windows,browser,"Mozilla/5.0 (Windows NT 10.0; WOW64) AppleWebKit/537.36 (KHTML, like Gecko) Chrome/99.0.4844.84 Safari/537.36"
52717070,2022-04-23T07:11:40.688Z,ggm3029@gmail.com,newsletter,everyone,true,US,Seattle,WA,mobile,Android,mobile browser,"Mozilla/5.0 (Linux; Android 11; SM-A515F) AppleWebKit/537.36 (KHTML, like Gecko) Chrome/100.0.4896.127 Mobile Safari/537.36"
52717070,2022-04-23T12:29:47.823Z,david810@gmail.com,newsletter,everyone,true,US,Seattle,WA,mobile,iOS,mobile browser,"Mozilla/5.0 (iPhone; CPU iPhone OS 15_4 like Mac OS X) AppleWebKit/605.1.15 (KHTML, like Gecko) CriOS/99.0.4844.59 Mobile/15E148 Safari/604.1"
52717070,2022-04-23T13:52:36.795Z,ling.j.zhong@gmail.com,newsletter,everyone,true,US,Seattle,WA,mobile,iOS,mobile browser,"Mozilla/5.0 (iPhone; CPU iPhone OS 15_4_1 like Mac OS X) AppleWebKit/605.1.15 (KHTML, like Gecko) Version/15.4 Mobile/15E148 Safari/604.1"
